{
  "id": "harrowmere",
  "name": "Harrowmere",
  "grid": {
    "width": 48,
    "height": 48
  },
  "description": "A small inland village on a millstream. One square, one tavern, one chapel; everyone knows everyone, which is the point.",
  "locations": [
    {
      "id": "market_square",
      "name": "Market Square",
      "kind": "public",
      "rect": [
        18,
        18,
        12,
        12
      ],
      "door": [
        24,
        30
      ],
      "privacy": 0.0,
      "tags": [
        "gathering",
        "commerce"
      ],
      "objects": [
        {
          "id": "notice_board",
          "name": "Parish Notice Board",
          "state": "posted",
          "interactions": {
            "read": "posted",
            "post_notice": "freshly_posted"
          }
        },
        {
          "id": "handcart",
          "name": "Common Handcart",
          "state": "empty",
          "interactions": {
            "load": "loaded",
            "unload": "empty"
          }
        }
      ]
    },
    {
      "id": "village_well",
      "name": "The Village Well",
      "kind": "public",
      "rect": [
        22,
        14,
        4,
        4
      ],
      "door": [
        24,
        18
      ],
      "privacy": 0.0,
      "tags": [
        "gathering",
        "water"
      ],
      "objects": [
        {
          "id": "well_bucket",
          "name": "Well Bucket",
          "state": "empty",
          "interactions": {
            "draw_water": "full",
            "pour_out": "empty"
          }
        },
        {
          "id": "stone_trough",
          "name": "Stone Trough",
          "state": "half_full",
          "interactions": {
            "fill": "full",
            "drain": "empty"
          }
        }
      ]
    },
    {
      "id": "gilded_perch",
      "name": "The Gilded Perch",
      "kind": "tavern",
      "rect": [
        12,
        30,
        8,
        6
      ],
      "door": [
        16,
        30
      ],
      "privacy": 0.1,
      "tags": [
        "gathering",
        "food",
        "drink",
        "lodging"
      ],
      "objects": [
        {
          "id": "perch_hearth",
          "name": "Taproom Hearth",
          "state": "banked",
          "interactions": {
            "stoke": "lit",
            "bank": "banked"
          }
        },
        {
          "id": "ale_barrel",
          "name": "Autumn Ale Barrel",
          "state": "sealed",
          "interactions": {
            "tap": "tapped",
            "seal": "sealed"
          }
        },
        {
          "id": "guest_ledger",
          "name": "Guest Ledger",
          "state": "closed",
          "interactions": {
            "open_ledger": "open",
            "close_ledger": "closed"
          }
        }
      ]
    },
    {
      "id": "crane_bakery",
      "name": "Crane Bakery",
      "kind": "shop_home",
      "rect": [
        30,
        30,
        6,
        5
      ],
      "door": [
        32,
        30
      ],
      "privacy": 0.3,
      "tags": [
        "food",
        "commerce"
      ],
      "objects": [
        {
          "id": "bread_oven",
          "name": "Bread Oven",
          "state": "cold",
          "interactions": {
            "fire": "fired",
            "rake_out": "cold"
          }
        },
        {
          "id": "kneading_table",
          "name": "Kneading Table",
          "state": "clean",
          "interactions": {
            "knead": "floured",
            "scrub": "clean"
          }
        }
      ]
    },
    {
      "id": "vosse_smithy",
      "name": "Vosse Smithy",
      "kind": "shop_home",
      "rect": [
        10,
        20,
        6,
        5
      ],
      "door": [
        16,
        22
      ],
      "privacy": 0.3,
      "tags": [
        "craft",
        "commerce"
      ],
      "objects": [
        {
          "id": "forge",
          "name": "Forge",
          "state": "banked",
          "interactions": {
            "stoke": "roaring",
            "bank": "banked"
          }
        },
        {
          "id": "anvil",
          "name": "Anvil",
          "state": "idle",
          "interactions": {
            "work_metal": "ringing",
            "set_down": "idle"
          }
        },
        {
          "id": "quench_barrel",
          "name": "Quench Barrel",
          "state": "full",
          "interactions": {
            "quench": "steaming",
            "refill": "full"
          }
        }
      ]
    },
    {
      "id": "quill_store",
      "name": "Quill's General Goods",
      "kind": "shop_home",
      "rect": [
        30,
        20,
        6,
        5
      ],
      "door": [
        30,
        22
      ],
      "privacy": 0.2,
      "tags": [
        "commerce"
      ],
      "objects": [
        {
          "id": "shop_counter",
          "name": "Shop Counter",
          "state": "shuttered",
          "interactions": {
            "open_shop": "open",
            "shutter": "shuttered"
          }
        },
        {
          "id": "stock_shelves",
          "name": "Stockroom Shelves",
          "state": "stocked",
          "interactions": {
            "pick_stock": "picked_over",
            "restock": "stocked"
          }
        }
      ]
    },
    {
      "id": "marsh_cottage",
      "name": "Marsh Cottage",
      "kind": "shop_home",
      "rect": [
        38,
        12,
        5,
        5
      ],
      "door": [
        38,
        14
      ],
      "privacy": 0.5,
      "tags": [
        "herbalism",
        "healing"
      ],
      "objects": [
        {
          "id": "drying_rack",
          "name": "Herb Drying Rack",
          "state": "hung_with_herbs",
          "interactions": {
            "hang_herbs": "hung_with_herbs",
            "strip_herbs": "bare"
          }
        },
        {
          "id": "still_pot",
          "name": "Still Pot",
          "state": "idle",
          "interactions": {
            "set_simmering": "simmering",
            "cool": "idle"
          }
        }
      ]
    },
    {
      "id": "chapel",
      "name": "Chapel of the Lamp",
      "kind": "chapel",
      "rect": [
        20,
        4,
        8,
        7
      ],
      "door": [
        24,
        11
      ],
      "privacy": 0.2,
      "tags": [
        "gathering",
        "teaching"
      ],
      "objects": [
        {
          "id": "chapel_bell",
          "name": "Chapel Bell",
          "state": "silent",
          "interactions": {
            "ring": "just_rung",
            "let_still": "silent"
          }
        },
        {
          "id": "lectern",
          "name": "Lectern",
          "state": "book_closed",
          "interactions": {
            "open_book": "book_open",
            "close_book": "book_closed"
          }
        }
      ]
    },
    {
      "id": "ferrin_mill",
      "name": "Ferrin Mill",
      "kind": "mill",
      "rect": [
        4,
        38,
        7,
        6
      ],
      "door": [
        11,
        40
      ],
      "privacy": 0.3,
      "tags": [
        "craft",
        "commerce",
        "millstream"
      ],
      "objects": [
        {
          "id": "millstone",
          "name": "Millstone",
          "state": "still",
          "interactions": {
            "engage": "turning",
            "disengage": "still"
          }
        },
        {
          "id": "grain_hopper",
          "name": "Grain Hopper",
          "state": "empty",
          "interactions": {
            "fill_hopper": "full",
            "run_through": "empty"
          }
        },
        {
          "id": "sluice_gate",
          "name": "Sluice Gate",
          "state": "closed",
          "interactions": {
            "open_gate": "open",
            "close_gate": "closed"
          }
        }
      ]
    },
    {
      "id": "hale_farm",
      "name": "Hale Farmstead",
      "kind": "farm",
      "rect": [
        36,
        38,
        10,
        8
      ],
      "door": [
        36,
        42
      ],
      "privacy": 0.4,
      "tags": [
        "food",
        "fields"
      ],
      "objects": [
        {
          "id": "field_plot",
          "name": "Field Plot",
          "state": "fallow",
          "interactions": {
            "till": "tilled",
            "sow": "sown",
            "leave_fallow": "fallow"
          }
        },
        {
          "id": "cow_byre",
          "name": "Cow Byre",
          "state": "quiet",
          "interactions": {
            "feed_animals": "fed",
            "muck_out": "mucked"
          }
        }
      ]
    },
    {
      "id": "weaver_cottage",
      "name": "Weaver Cottage",
      "kind": "home",
      "rect": [
        6,
        8,
        5,
        5
      ],
      "door": [
        11,
        10
      ],
      "privacy": 0.6,
      "tags": [],
      "objects": [
        {
          "id": "loom",
          "name": "Loom",
          "state": "warped",
          "interactions": {
            "weave": "mid_weave",
            "tie_off": "warped"
          }
        },
        {
          "id": "spinning_wheel",
          "name": "Spinning Wheel",
          "state": "idle",
          "interactions": {
            "spin": "spinning",
            "stop_wheel": "idle"
          }
        }
      ]
    },
    {
      "id": "tarn_cabin",
      "name": "Tarn Cabin",
      "kind": "home",
      "rect": [
        42,
        4,
        4,
        4
      ],
      "door": [
        42,
        8
      ],
      "privacy": 0.8,
      "tags": [
        "edge_of_town"
      ],
      "objects": [
        {
          "id": "wood_stove",
          "name": "Wood Stove",
          "state": "cold",
          "interactions": {
            "light_stove": "burning",
            "damp_down": "cold"
          }
        },
        {
          "id": "workbench",
          "name": "Workbench",
          "state": "ordered",